{
  "schema_version": "version_manifest.v1",
  "manifest_id": "pipeline_stage3_stage3_v6_qwen2.5vl_7b",
  "created_at": "2026-08-07T15:25:24.856624+00:00",
  "prompt": {
    "prompt_id": "stage3",
    "version": "stage3_v6",
    "content_hash": "dd4de5b037f5592132dca96a3ed3550f37f89b758db20ae026c9afc8e0620119",
    "profile": "stage3_v6"
  },
  "model": {
    "provider": "ollama",
    "model_name": "qwen2.5vl:7b",
    "temperature": 0.0,
    "num_predict": 512,
    "fallback_model_name": null,
    "endpoint_class": "local_ollama",
    "agent_chat_model": null,
    "digest": null
  },
  "workflow": {
    "workflow_id": "pipeline_stage3",
    "version": "0.1.0",
    "config_hash": "7d5206e94719f2bdd4f47c42ae6471af3dadfc8412f9ac1e8a39ce9b1ce408af",
    "stage3_strategy": "full_only",
    "gating": false,
    "planner": null
  },
  "dataset": {
    "name": "golden_apr_jul_2026",
    "version": "0.2.0",
    "labels_sha256": "747adbdee48bae4c116c5e476cee00af5f496abdc713fd405f95c8bd4e2a4f36",
    "manifest_sha256": "0b207c2e7228be679e04b076d97e967fc8be0cd377dafbae7494f02d2d3f71c5"
  },
  "code": {
    "git_sha": "ab536807295b0e4ea574ca740c85495051776730",
    "dirty": true,
    "ref": "HEAD"
  },
  "eval_protocol": "quality_protocol_v1",
  "tags": [
    "config:configs/eval_stage3.yaml"
  ],
  "version_manifest_hash": "54d0565fa2b6f155275bfb91d19b525d1b22f0df690aae931317d540f1d9132a"
}
